{"raw_output":"{\"schema_version\":1,\"task_id\":\"page-ef87ffd2f4f3\",\"verdict\":\"material\",\"material_region_ids\":[\"region-44d8060263\"],\"ignored_region_ids\":[\"region-2451168d91\",\"region-7946f74ea0\"],\"evidence\":[{\"region_id\":\"region-44d8060263\",\"before\":\"Gate: B12\",\"after\":\"Gate: B19\"}]}","run":{"run_id":"efe2efed6ed5ea73d4a61758e99c7ae1"},"schema_version":1,"task":{"after_html":"<main class=\"flight-shell\"><h1>Flight OD214</h1><section data-region-id=\"region-44d8060263\">Gate: B19</section><aside data-region-id=\"region-2451168d91\">Boarding in 33</aside><footer data-region-id=\"region-7946f74ea0\">Refreshed at 2026-08-24T06:27Z</footer></main>","before_html":"<main class=\"flight-shell\"><h1>Flight OD214</h1><section data-region-id=\"region-44d8060263\">Gate: B12</section><aside data-region-id=\"region-2451168d91\">Boarding in 40</aside><footer data-region-id=\"region-7946f74ea0\">Refreshed at 2026-08-24T06:12Z</footer></main>","region_ids":["region-44d8060263","region-2451168d91","region-7946f74ea0"]},"task_id":"page-ef87ffd2f4f3"}
