{"raw_output":"{\"schema_version\":1,\"task_id\":\"page-1397892817f0\",\"verdict\":\"material\",\"material_region_ids\":[\"region-98f27d517a\"],\"ignored_region_ids\":[\"region-ed94edbcd3\",\"region-94f69721a4\"],\"evidence\":[{\"region_id\":\"region-98f27d517a\",\"before\":\"Status: Open\",\"after\":\"Status: Resolved\"}]}","run":{"run_id":"39da2815048ae68e8f4d761512e56d7a"},"schema_version":1,"task":{"after_html":"<main class=\"ticket-shell\"><h1>Ticket #90142</h1><section data-region-id=\"region-98f27d517a\">Status: Resolved</section><aside data-region-id=\"region-ed94edbcd3\">Queue depth: 11</aside><footer data-region-id=\"region-94f69721a4\">Updated at 2026-08-24T08:31Z</footer></main>","before_html":"<main class=\"ticket-shell\"><h1>Ticket #90142</h1><section data-region-id=\"region-98f27d517a\">Status: Open</section><aside data-region-id=\"region-ed94edbcd3\">Queue depth: 14</aside><footer data-region-id=\"region-94f69721a4\">Updated at 2026-08-24T08:02Z</footer></main>","region_ids":["region-98f27d517a","region-ed94edbcd3","region-94f69721a4"]},"task_id":"page-1397892817f0"}
