{"raw_output":"{\"schema_version\":1,\"task_id\":\"page-42bde55d833f\",\"verdict\":\"material\",\"material_region_ids\":[\"region-201067bbab\",\"region-6f13d19014\"],\"ignored_region_ids\":[\"region-479da38d6c\"],\"evidence\":[{\"region_id\":\"region-201067bbab\",\"before\":\"Active vehicles: 18\",\"after\":\"Active vehicles: 21\"},{\"region_id\":\"region-6f13d19014\",\"before\":\"Avg delay: 4 min\",\"after\":\"Avg delay: 6 min\"}]}","run":{"run_id":"0c7b1c2230efae56fc1f64bcb664118d"},"schema_version":1,"task":{"after_html":"<main class=\"fleet-shell\"><h1>Fleet Status</h1><section data-region-id=\"region-201067bbab\">Active vehicles: 21</section><aside data-region-id=\"region-6f13d19014\">Avg delay: 6 min</aside><footer data-region-id=\"region-479da38d6c\">Refreshed at 2026-08-24T11:35Z</footer></main>","before_html":"<main class=\"fleet-shell\"><h1>Fleet Status</h1><section data-region-id=\"region-201067bbab\">Active vehicles: 18</section><aside data-region-id=\"region-6f13d19014\">Avg delay: 4 min</aside><footer data-region-id=\"region-479da38d6c\">Refreshed at 2026-08-24T11:05Z</footer></main>","region_ids":["region-201067bbab","region-6f13d19014","region-479da38d6c"]},"task_id":"page-42bde55d833f"}
